{
  "_comment": "Your details. Only 'name' is filled in for real — replace the rest. See EDITING.md.",
  "name": "Thanh Vu",
  "role": "Undergraduate Student",
  "tagline": "Open to internships and graduate opportunities",
  "years_experience": 0,
  "specialty": "Your field of study",
  "summary": "<p>Replace this with two or three sentences about yourself: what you study, what you are good at, and what kind of role or programme you are looking for. The first 180 characters appear on the home page, so put the important part first.</p>",
  "email": "your.email@example.com",
  "location": "",
  "avatar_url": "/images/avatar.svg"
}
